{"variant_id":"variant-82d8c3944ac04207169ab11c979643cefb53c150893f3414af32ff68918725ee","evaluation_version":"planar-massing-v1","metrics":[{"name":"footprint_area","value":198.16092078661384,"unit":"m2","method_version":"planar-massing-v1"},{"name":"gross_floor_area","value":594.4827623598416,"unit":"m2","method_version":"planar-massing-v1"},{"name":"height","value":9.600000000000001,"unit":"m","method_version":"planar-massing-v1"},{"name":"xmin","value":5.052881875657741,"unit":"m","method_version":"planar-massing-v1"},{"name":"ymin","value":6.26847896731718,"unit":"m","method_version":"planar-massing-v1"},{"name":"xmax","value":13.72276527442892,"unit":"m","method_version":"planar-massing-v1"},{"name":"ymax","value":31.309940303809082,"unit":"m","method_version":"planar-massing-v1"},{"name":"clearance_west","value":5.052881875657741,"unit":"m","method_version":"planar-massing-v1"},{"name":"clearance_east","value":6.2772347255710805,"unit":"m","method_version":"planar-massing-v1"},{"name":"clearance_south","value":6.26847896731718,"unit":"m","method_version":"planar-massing-v1"},{"name":"clearance_north","value":3.690059696190918,"unit":"m","method_version":"planar-massing-v1"},{"name":"target_gfa_delta","value":-305.51723764015844,"unit":"m2","method_version":"planar-massing-v1"}],"checks":[{"constraint_id":"site_containment","result":"PASS","measured":3.690059696190918,"limit":0.0,"explanation":"Minimum signed clearance to declared site; length tolerance applies","required":true},{"constraint_id":"height","result":"PASS","measured":9.600000000000001,"limit":12.0,"explanation":"Declared MaxHeight; source=user_brief; authority=assumption (unverified); geometric measurement only","required":true},{"constraint_id":"setback","result":"PASS","measured":3.690059696190918,"limit":3.0,"explanation":"Declared MinEdgeSetback; source=user_brief; authority=assumption (unverified); geometric measurement only","required":true}],"tolerance":{"length_m":1e-6,"area_m2":1e-6,"method_version":"absolute-si-v1"},"geometry_parity_budget":{"policy_version":"polygon-coordinate-parity-v1","coordinate_length_m":1e-6,"footprint_area_m2":0.00006742269547052617,"gross_floor_area_m2":0.00020226808641157852,"rigid_transform_policy_version":"rigid-xy-ordered-v1"},"required_checks_passed":true,"professional_limits":"Measures declared geometric bounds only; not legal compliance or professional certification. Sources and authority are unverified declarations. GFA approximates repeated footprint area; daylight, structure, access, cost and local regulations are uncomputed."}